{
  "business": {
    "name": "Northwind",
    "industry": "B2B SaaS — operations analytics",
    "description": "Northwind gives operations teams a live picture of their supply chain, so they can act before problems become outages.",
    "tone": "confident, plain-spoken, no hype"
  },
  "goals": {
    "primary": "Book product demos",
    "secondary": ["Communicate credibility", "Explain pricing clearly"]
  },
  "audience": "Heads of operations and supply-chain leads at mid-market manufacturers.",
  "brand": {
    "theme": "light",
    "accent": "trustworthy indigo",
    "logo": "/assets/northwind-logo.svg",
    "voice": "Direct sentences. Concrete claims. No jargon."
  },
  "pages": [{ "type": "landing", "path": "/" }],
  "content": {
    "eyebrow": "Operations analytics",
    "headline": "See the problem before it ships",
    "valueProposition": "Northwind turns scattered operational data into one live picture — so your team acts early, not after the outage.",
    "primaryCta": { "label": "Book a demo", "href": "/demo" },
    "secondaryCta": { "label": "See how it works", "href": "/product" },
    "heroMedia": { "url": "/assets/dashboard.png", "alt": "The Northwind operations dashboard" },
    "features": [
      { "icon": "chart-line", "title": "Live signal", "body": "Every feed in one place, updated continuously — no more stale spreadsheets." },
      { "icon": "bell", "title": "Early warning", "body": "Anomaly alerts fire before a delay turns into a stockout." },
      { "icon": "plug", "title": "Connects to everything", "body": "ERP, WMS, and logistics APIs, live in minutes." },
      { "icon": "lock", "title": "Enterprise-ready", "body": "SOC 2, SSO, and role-based access out of the box." }
    ],
    "pricingTiers": [
      { "name": "Starter", "price": "$0", "period": "/mo", "description": "For a single team getting started.", "features": ["1 workspace", "3 data sources", "Email alerts"], "cta": { "label": "Start free", "href": "/signup" } },
      { "name": "Growth", "price": "$490", "period": "/mo", "description": "For scaling operations.", "features": ["Unlimited workspaces", "20 data sources", "Anomaly detection", "SSO"], "cta": { "label": "Book a demo", "href": "/demo" }, "highlighted": true },
      { "name": "Enterprise", "price": "Custom", "description": "For complex, multi-site operations.", "features": ["Unlimited data sources", "Dedicated support", "Custom SLAs", "On-prem option"], "cta": { "label": "Contact sales", "href": "/contact" } }
    ],
    "testimonials": [
      { "quote": "We caught a supplier delay four days early. That one alert paid for the year.", "author": "Dana Reyes", "role": "VP Operations, Meridian Parts" },
      { "quote": "Finally, one dashboard the whole floor trusts.", "author": "Sam Okafor", "role": "Supply Chain Lead, Halcyon Foods" }
    ],
    "faqs": [
      { "question": "How long does setup take?", "answer": "Most teams connect their first data sources and see live signal within a day." },
      { "question": "Do you support on-prem systems?", "answer": "Yes — the Enterprise plan includes on-prem connectors and a dedicated integration engineer." },
      { "question": "Is my data secure?", "answer": "Northwind is SOC 2 Type II certified, with SSO and role-based access on every paid plan." }
    ],
    "nav": [
      { "label": "Product", "href": "/product" },
      { "label": "Pricing", "href": "/pricing" },
      { "label": "Customers", "href": "/customers" },
      { "label": "Docs", "href": "/docs" }
    ],
    "footerColumns": [
      { "title": "Product", "links": [{ "label": "Overview", "href": "/product" }, { "label": "Pricing", "href": "/pricing" }, { "label": "Security", "href": "/security" }] },
      { "title": "Company", "links": [{ "label": "About", "href": "/about" }, { "label": "Careers", "href": "/careers" }, { "label": "Contact", "href": "/contact" }] },
      { "title": "Resources", "links": [{ "label": "Docs", "href": "/docs" }, { "label": "Blog", "href": "/blog" }, { "label": "Status", "href": "/status" }] }
    ]
  }
}
